{
  "tiltakstype": "MENTOR",
  "avtaleId": "0163f4a6-6927-440b-9e1d-0197090c5336",
  "avtaleVersjonId": "fb8461e5-fb0c-49cf-b349-530c0a086c93",
  "deltakerFnr": "00000000000",
  "bedriftNr": "990983666",
  "veilederNavIdent": "Z992785",
  "opprettet": "2020-02-11",
  "deltakerFornavn": "Jo",
  "deltakerEtternavn": "Å",
  "deltakerTlf": "777788888",
  "bedriftNavn": "NAV IKT",
  "arbeidsgiverFornavn": "Hans",
  "arbeidsgiverEtternavn": "Hansen",
  "arbeidsgiverTlf": "22222222",
  "veilederFornavn": "Bjarte",
  "veilederEtternavn": "Nilsen",
  "veilederTlf": "55555555",
  "oppfolging": "Følge opp",
  "tilrettelegging": "Legge til rette",
  "stillingprosent": 60,
  "versjon": 1,
  "mentorFornavn": "Sindre",
  "mentorEtternavn": "Løken",
  "mentorOppgaver": "Veilede",
  "mentorAntallTimer": 30,
  "mentorTimelonn": 400,
  "godkjentPaVegneGrunn": null,
  "arbeidsgiverKontonummer": null,
  "stillingstype": null,
  "arbeidsoppgaver": null,
  "lonnstilskuddProsent": null,
  "manedslonn": null,
  "feriepengesats": null,
  "arbeidsgiveravgift": null,
  "sluttDato": "2020-02-29",
  "startDato": "2020-02-11",
  "maal": [],
  "oppgaver": [],
  "godkjentAvDeltaker": "2020-02-11",
  "godkjentAvArbeidsgiver": "2020-02-11",
  "godkjentAvVeileder": "2020-02-11",
  "godkjentPaVegneAv": false
}