{
  "tiltakstype": "MIDLERTIDIG_LONNSTILSKUDD",
  "avtaleId": "ca3d7189-0852-4693-a3dd-d518b4ec42e4",
  "avtaleVersjonId": "878c49f4-7225-4bb7-becf-a63b90a1baf7",
  "deltakerFnr": "02018099999",
  "bedriftNr": "999988881",
  "veilederNavIdent": "X123456",
  "opprettet": "2019-09-09",
  "versjon": 2,
  "deltakerFornavn": "Ronny",
  "deltakerEtternavn": "Deltaker",
  "deltakerTlf": "00000000",
  "bedriftNavn": "Hansen AS",
  "arbeidsgiverFornavn": "Ronnys",
  "arbeidsgiverEtternavn": "Kremmer",
  "arbeidsgiverTlf": "22334455",
  "veilederFornavn": "Jan-Ronny",
  "veilederEtternavn": "Veileder",
  "veilederTlf": "33445566",
  "oppfolging": "Telefon hver uke",
  "tilrettelegging": "Ingen",
  "startDato": "2019-01-01",
  "sluttDato": "2019-02-02",
  "stillingprosent": 100,
  "godkjentPaVegneGrunn": null,
  "godkjentAvDeltaker": "2019-09-09",
  "godkjentAvArbeidsgiver": "2019-10-09",
  "godkjentAvVeileder": "2019-11-09",
  "godkjentPaVegneAv": false,
  "arbeidsgiverKontonummer": "11122233344",
  "stillingstype": "Stilling",
  "arbeidsoppgaver": "- Lagerarbeid\nBeskrivelse: Rydde på lageret\nOpplæring: Ryddekurs\n\n- Lagerarbeid\nBeskrivelse: Rydde på lageret\nOpplæring: Ryddekurs\n\n- Lagerarbeid\nBeskrivelse: Rydde på lageret\nOpplæring: Ryddekurs",
  "lonnstilskuddProsent": 40,
  "manedslonn": 10000,
  "feriepengesats": 10.2,
  "arbeidsgiveravgift": 14.1
}